{"$schema":"https://json-schema.org/draft/2020-12/schema","$id":"https://struthio.invalid/schema/episode-pack-v1.json","title":"STRUTHIO Console Episode Pack API v1","type":"object","additionalProperties":false,"required":["apiVersion","id","title","buildId","saveNamespace","assets","presentation"],"properties":{"apiVersion":{"const":1},"id":{"type":"string","pattern":"^[a-z0-9][a-z0-9-]{1,31}$"},"title":{"type":"string","minLength":1},"buildId":{"type":"string","minLength":1},"saveNamespace":{"type":"string","pattern":"^struthio\\.console\\.[a-z0-9.-]+\\.v[0-9]+$"},"assets":{"type":"object","required":["islands","backgrounds","cinemaPanels","theaterReel","startScreen","manual"],"properties":{"authority":{"$ref":"#/$defs/asset"},"bird":{"$ref":"#/$defs/asset"},"rider":{"$ref":"#/$defs/asset"},"riderMap":{"$ref":"#/$defs/asset"},"islands":{"$ref":"#/$defs/islands"},"backgrounds":{"type":"array","minItems":6,"maxItems":6,"items":{"$ref":"#/$defs/backgroundPair"}},"cinemaPanels":{"$ref":"#/$defs/asset"},"theaterReel":{"$ref":"#/$defs/asset"},"startScreen":{"$ref":"#/$defs/asset"},"manual":{"$ref":"#/$defs/asset"},"icon192":{"$ref":"#/$defs/asset"},"icon512":{"$ref":"#/$defs/asset"},"appleTouchIcon":{"$ref":"#/$defs/asset"},"shareCard":{"$ref":"#/$defs/asset"},"audio":{"anyOf":[{"$ref":"#/$defs/asset"},{"type":"null"}]}}},"presentation":{"type":"object","required":["palette","ui"],"properties":{"palette":{"type":"object"},"ui":{"type":"object"},"shellPalette":{"$ref":"#/$defs/shellPalette"},"controllerPalette":{"$ref":"#/$defs/controllerPalette"}}}},"$defs":{"asset":{"type":"object","required":["path","sha256"],"properties":{"path":{"type":"string","minLength":1},"sha256":{"type":"string","pattern":"^[0-9a-f]{64}$"},"width":{"type":"integer","minimum":1},"height":{"type":"integer","minimum":1},"alpha":{"type":"boolean"}}},"backgroundPair":{"type":"object","required":["rear","near"],"properties":{"rear":{"$ref":"#/$defs/asset"},"near":{"$ref":"#/$defs/asset"}}},"islands":{"allOf":[{"$ref":"#/$defs/asset"}],"type":"object","required":["metadata"],"properties":{"metadata":{"type":"object","required":["masters"],"properties":{"masters":{"type":"array","minItems":15,"maxItems":15,"items":{"type":"object"}}}}}},"color":{"type":"string","pattern":"^#[0-9A-Fa-f]{6}$","description":"Normalized colour token #RRGGBB. Console validates each role independently and falls back per role."},"shellPalette":{"type":"object","additionalProperties":false,"description":"Optional semantic shell colours. Roles map to Console-owned variables; contrast pairs (text/textDim on ink and text on graphite >= 4.5:1; accent/edge/danger on ink >= 3:1) are enforced at runtime with per-role fallback.","properties":{"accent":{"$ref":"#/$defs/color","description":"Shell accent / power light"},"edge":{"$ref":"#/$defs/color","description":"Primary action edge"},"text":{"$ref":"#/$defs/color","description":"Shell text"},"textDim":{"$ref":"#/$defs/color","description":"Secondary shell text"},"danger":{"$ref":"#/$defs/color","description":"Danger / alarm"},"ink":{"$ref":"#/$defs/color","description":"Shell background ink"},"graphite":{"$ref":"#/$defs/color","description":"Panel graphite"}}},"controllerPalette":{"type":"object","additionalProperties":false,"description":"Optional semantic wing-controller colours; each must reach 3:1 against the effective shell ink.","properties":{"accent":{"$ref":"#/$defs/color","description":"Wing glyph accent"},"edge":{"$ref":"#/$defs/color","description":"Wing ring edge"}}}}}
