{"apiVersion":1,"id":"dev-00","title":"DEV-00 Floppy Diagnostic ROM","buildId":"DEV-00-3.0.0","saveNamespace":"struthio.console.dev-00.v3","assets":{"bird":{"path":"assets/war-bird-192.webp","sha256":"ed43d164dfa0f94238a3ce5c9e3c88e0bbc413756597b2e986dacefa0104217c","width":1536,"height":1152,"alpha":true,"frameGrid":[16,12],"frames":192,"logicalCell":[32,32],"rasterCell":[96,96],"drawOffset":[1,4],"collision":[13,11]},"islands":{"path":"assets/islands-v2.webp","sha256":"d16b77d908b67f781b89b3f1521f478a6bd5b7ffc617a40624a67f4f6a3e9626","width":1920,"height":480,"alpha":true,"metadata":{"version":2,"masters":[{"id":"STD_01","role":"STANDARD","x":108,"y":8,"w":168,"h":142,"capTop":0,"affinity":["STATIC","DRIFT_X_SOFT","BOB_Y_SOFT","HOLD_SHIFT_X"],"signalRects":[{"x":79,"y":34,"w":10,"h":76}]},{"id":"STD_02","role":"STANDARD","x":474,"y":8,"w":204,"h":142,"capTop":0,"affinity":["STATIC","DRIFT_X_SOFT","BOB_Y_SOFT","HOLD_SHIFT_X"],"signalRects":[{"x":97,"y":34,"w":10,"h":76}]},{"id":"STD_03","role":"STANDARD","x":842,"y":8,"w":236,"h":142,"capTop":0,"affinity":["STATIC","DRIFT_X_SOFT","BOB_Y_SOFT","HOLD_SHIFT_X"],"signalRects":[{"x":113,"y":34,"w":10,"h":76}]},{"id":"STD_04","role":"STANDARD","x":1209,"y":8,"w":270,"h":142,"capTop":0,"affinity":["STATIC","DRIFT_X_SOFT","BOB_Y_SOFT","HOLD_SHIFT_X"],"signalRects":[{"x":130,"y":34,"w":10,"h":76}]},{"id":"STD_05","role":"STANDARD","x":1634,"y":8,"w":188,"h":142,"capTop":0,"affinity":["STATIC","DRIFT_X_SOFT","BOB_Y_SOFT","HOLD_SHIFT_X"],"signalRects":[{"x":89,"y":34,"w":10,"h":76}]},{"id":"STD_06","role":"STANDARD","x":80,"y":168,"w":224,"h":142,"capTop":0,"affinity":["STATIC","DRIFT_X_SOFT","BOB_Y_SOFT","HOLD_SHIFT_X"],"signalRects":[{"x":107,"y":34,"w":10,"h":76}]},{"id":"STD_07","role":"STANDARD","x":450,"y":168,"w":252,"h":142,"capTop":0,"affinity":["STATIC","DRIFT_X_SOFT","BOB_Y_SOFT","HOLD_SHIFT_X"],"signalRects":[{"x":121,"y":34,"w":10,"h":76}]},{"id":"STD_08","role":"STANDARD","x":814,"y":168,"w":292,"h":142,"capTop":0,"affinity":["STATIC","DRIFT_X_SOFT","BOB_Y_SOFT","HOLD_SHIFT_X"],"signalRects":[{"x":141,"y":34,"w":10,"h":76}]},{"id":"STD_09","role":"STANDARD","x":1185,"y":168,"w":318,"h":142,"capTop":0,"affinity":["STATIC","DRIFT_X_SOFT","BOB_Y_SOFT","HOLD_SHIFT_X"],"signalRects":[{"x":154,"y":34,"w":10,"h":76}]},{"id":"BOSS_01","role":"BOSS","x":1593,"y":168,"w":270,"h":142,"capTop":0,"affinity":["BOSS"],"signalRects":[{"x":130,"y":34,"w":10,"h":76}]},{"id":"BOSS_02","role":"BOSS","x":49,"y":328,"w":286,"h":142,"capTop":0,"affinity":["BOSS"],"signalRects":[{"x":138,"y":34,"w":10,"h":76}]},{"id":"BOSS_03","role":"BOSS","x":425,"y":328,"w":302,"h":142,"capTop":0,"affinity":["BOSS"],"signalRects":[{"x":146,"y":34,"w":10,"h":76}]},{"id":"BOSS_04","role":"BOSS","x":801,"y":328,"w":318,"h":142,"capTop":0,"affinity":["BOSS"],"signalRects":[{"x":154,"y":34,"w":10,"h":76}]},{"id":"BOSS_05","role":"BOSS","x":1177,"y":328,"w":334,"h":142,"capTop":0,"affinity":["BOSS"],"signalRects":[{"x":162,"y":34,"w":10,"h":76}]},{"id":"GROUND","role":"GROUND","x":1554,"y":320,"w":348,"h":150,"capTop":0,"affinity":["STATIC"],"signalRects":[{"x":32,"y":34,"w":12,"h":96},{"x":304,"y":34,"w":12,"h":96}]}]}},"backgrounds":[{"rear":{"path":"assets/backgrounds/stage-0-rear.webp","sha256":"edb985b37c72c8e1fffcd813403f69cebf1fcaf8469d81dbdd4b3e4698fde6cb","width":768,"height":2304,"alpha":false},"near":{"path":"assets/backgrounds/stage-0-near.webp","sha256":"2da7918d017cbb57ff88d52e800f2b823e37f2a2bdb6edb0ec08c889fec105d7","width":768,"height":2304,"alpha":true}},{"rear":{"path":"assets/backgrounds/stage-0-rear.webp","sha256":"edb985b37c72c8e1fffcd813403f69cebf1fcaf8469d81dbdd4b3e4698fde6cb","width":768,"height":2304,"alpha":false},"near":{"path":"assets/backgrounds/stage-0-near.webp","sha256":"2da7918d017cbb57ff88d52e800f2b823e37f2a2bdb6edb0ec08c889fec105d7","width":768,"height":2304,"alpha":true}},{"rear":{"path":"assets/backgrounds/stage-0-rear.webp","sha256":"edb985b37c72c8e1fffcd813403f69cebf1fcaf8469d81dbdd4b3e4698fde6cb","width":768,"height":2304,"alpha":false},"near":{"path":"assets/backgrounds/stage-0-near.webp","sha256":"2da7918d017cbb57ff88d52e800f2b823e37f2a2bdb6edb0ec08c889fec105d7","width":768,"height":2304,"alpha":true}},{"rear":{"path":"assets/backgrounds/stage-0-rear.webp","sha256":"edb985b37c72c8e1fffcd813403f69cebf1fcaf8469d81dbdd4b3e4698fde6cb","width":768,"height":2304,"alpha":false},"near":{"path":"assets/backgrounds/stage-0-near.webp","sha256":"2da7918d017cbb57ff88d52e800f2b823e37f2a2bdb6edb0ec08c889fec105d7","width":768,"height":2304,"alpha":true}},{"rear":{"path":"assets/backgrounds/stage-0-rear.webp","sha256":"edb985b37c72c8e1fffcd813403f69cebf1fcaf8469d81dbdd4b3e4698fde6cb","width":768,"height":2304,"alpha":false},"near":{"path":"assets/backgrounds/stage-0-near.webp","sha256":"2da7918d017cbb57ff88d52e800f2b823e37f2a2bdb6edb0ec08c889fec105d7","width":768,"height":2304,"alpha":true}},{"rear":{"path":"assets/backgrounds/stage-0-rear.webp","sha256":"edb985b37c72c8e1fffcd813403f69cebf1fcaf8469d81dbdd4b3e4698fde6cb","width":768,"height":2304,"alpha":false},"near":{"path":"assets/backgrounds/stage-0-near.webp","sha256":"2da7918d017cbb57ff88d52e800f2b823e37f2a2bdb6edb0ec08c889fec105d7","width":768,"height":2304,"alpha":true}}],"cinemaPanels":{"path":"assets/cinema-panels.webp","sha256":"dbf14bfae4239fd711b1786888ba20448a517ccbe4920975aef1a1bccbedcc5d","width":4096,"height":2048,"alpha":false},"startScreen":{"path":"assets/start-screen.webp","sha256":"6efcf01f68797c714a62ecfdbe5ba7e11dc8af1c6f20bdcd0357bcfb2c501844","width":941,"height":1672,"alpha":false},"manual":{"path":"assets/manual.png","sha256":"300dda974b8583a3734e600fb8e697ce050ac68b3d2e664e5cd82ecd50be09b4","width":709,"height":1536,"alpha":false},"audio":{"path":"assets/dev-loop.wav","sha256":"80eb03db7e40492c4884949e61698da5e9b414220766e65464f3f25ae185d913","durationSeconds":1,"loop":true},"theaterReel":{"path":"assets/theater-reel.json","sha256":"af7dc7b3713ca88441d9a79cce9466e765567a05630592424759531ce4261cc7"},"authority":{"path":"authority.json","sha256":"b61e64eaa299ff42db9a825ddc4a3300e0b32248e0c89da49b78d6d52cb86d1f"},"rider":{"path":"assets/dev00-rider-attachments.webp","sha256":"992e8f4677b80355cf73d51491f1bf63cab2ca14e6672fd1fbb9c8a50ca98fc4","width":1536,"height":384,"alpha":true,"states":8,"frames":192},"riderMap":{"path":"assets/dev00-rider-attachments.json","sha256":"e003534bc6b70560f1f2d66ba600623ed392064a70249ae03aa5270d188c7ba5"}},"presentation":{"episodeBanner":"DEV-00 FLOPPY SYSTEMS","musicBpm":110,"palette":{"environment":["#070706","#242422"],"roles":["#C9BEA8","#42E7EF","#FFD35D","#242422","#C9BEA8"],"gameplayAccent":"#42E7EF","hudAccent":"#42E7EF","edge":"#FFD35D","alarm":"#FFD35D","ink":"#070706","text":"#C9BEA8"},"ui":{"heading":"SELECT SYSTEM RUN","credit":"STRUTHIO CONSOLE · BUILT-IN ROM","startNote":"DEV-00 ROM READY"},"accessibility":{"reducedMotion":true,"reducedTransparency":true,"highContrast":true}}}
